Name;Description;KeySkills;ProfessionalRoles;City;SBERT_Disciplines;SBERT_plus_LLaMA_Recommendations
Инженер по тестированию;"ОБЯЗАННОСТИ:  Проведение испытаний изделий на соответствии документации и стандартам Проверка качества разрабатываемых и производимых изделий Испытание радиотехнических изделий  ТРЕБОВАНИЯ:  Опыт работы тестирования РЭА не менее 2-х лет Знание и применение лабораторного измерительного оборудования Знание ЭМС, электробезопасности и методов испытаний изделий Базовые знания программирования  МЫ ПРЕДЛАГАЕМ:  Широкие возможности для развития - семинары, мастер – классы, корпоративная программа наставничества, программы для развития руководителей; «Белая» заработная плата, гибкое начало рабочего дня и полное соблюдение ТК; Профессиональное обучение за счёт Компании; Изучение английского в офисе за счет Компании; ДМС; Компенсация затрат на занятия спортом; Доступ к электронной библиотеке Альпина Диджитал для сотрудников; Автомат с полезной едой в офисе; Подарки сотрудникам к праздникам; Профессиональный коллектив; Отсутствие дресс-кода; Для авто есть парковка. ";;Тестировщик;Тула;"Методы и средства измерений, испытаний и контроля; Обеспечение качества и тестирование; Тестирование ПО; Разработка компьютерных тестов; Оценка технологий; Метрология и электрорадиоизмерения; Обеспечение качества и тестирование ИТ-систем; Основы надежности изделий; Научно-исследовательский семинар ""Промышленная инженерия программного обеспечения""; Автоматизированные системы обеспечения надежности и качества электронных средств; Экспериментальные методы исследования структуры и свойств материалов; Управление развитием продукта; Разработка и анализ требований; Обеспечение качества бизнес-приложений; Управление разработкой ПО; Научно-исследовательский семинар ""Методы научных исследований в менеджменте и бизнесе""; Научно-исследовательский семинар «Современные технологии создания ТЭ с ПЭ»; Электроника; Технологии программирования; Специальные технологии; Актуальные проблемы конкурентной (деловой) разведки; Основы промышленной разработки; Инструменты и программные средства анализа данных; Электротехника; Методология комплаенс-исследований в сравнительном праве";"Методы и средства измерений, испытаний и контроля; Обеспечение качества и тестирование; Тестирование ПО; Разработка компьютерных тестов; Оценка технологий; Основы надежности изделий; Управление разработкой ПО"
Маркетолог-креативщик;Медиапоинт - международный провайдер высокотехнологичных решений в индустрии онлайн-развлечений. В настоящий момент мы в поисках Маркетолога-креативщика в направление Медиабаинга. Обязанности:  Сбор инициатив: Сбор и анализ новых инициатив и идей для улучшения медиабаинга, сотрудничество с различными отделами для выявления перспективных направлений. Внедрение новых связок и A/B тестов: Разработка и запуск новых рекламных связок, воронок, проведение A/B тестов для определения наиболее эффективных подходов. Оптимизация стратегий: Постоянный анализ и оптимизация текущих медиабаинговых стратегий с целью улучшения показателей эффективности. Контроль креативов: Координация работы с креативными командами, обеспечение соответствия креативов стратегическим целям и стандартам качества.  Требования:  Опыт работы в медиабаинге или digital marketing от 3 лет. Опыт в сфере онлайн-развлечений от 1 года. Опыт разработки и внедрения маркетинговых стратегий. Знание подходов для продвижения в influence/social networks трафике (знание других типов трафика приветствуются). Креативность и способность генерировать новые идеи.  Условия:  Удаленная работа, возможность работы из любой точки мира. Гибкий график работы (пн-пт с 9/11 до 18/20). Работа в международной компании с многолетним опытом работы в игровой сфере. Дружный и амбициозный интернациональный коллектив. Уровень заработной платы обсуждается на финальных этапах собеседования. ;;Менеджер по маркетингу, интернет-маркетолог;Москва;"Использование игровых платформ в медиа; Бренд-медиа в коммуникациях: стратегии создания и продвижения; Бренд-медиа и отраслевая коммуникация в новых медиа; Организация консалтинговой деятельности в сфере медиа; Медийная реклама и программатик-закупки; Специальное проектирование. Запуск и управление медиастартапом; Создание проектов на медиаплатформах; Корпоративные и бренд-медиа; Медиаисследования: измерения и метрики; Технологии и новые направления в исследованиях медиа; Медиа-решения новых задач бизнеса; Исследования медиавоздействия и повестки дня; Монетизация медиа и организация отдела продаж в медиа; Медиа и технологические вызовы; Медиаменеджмент; Основы медиамаркетинга; Медиа решения новых задач бизнеса; Научно-исследовательский семинар ""Введение в медиаисследование""; Исследовательские парадигмы медиавоздействия и повестки дня; Технологии современных медиа; Медиамаркетинг; Основы консалтинговой деятельности в медиа; Новые медиа и бизнес-коммуникации; Управление медиа; Маркетинг медийных проектов";"Основы медиамаркетинга; Основы консалтинговой деятельности в медиа; Медиа и технологические вызовы; Медиаменеджмент; Технологии современных медиа; Исследования медиавоздействия и повестки дня; Научно-исследовательский семинар ""Введение в медиаисследование"""
Бухгалтер по работе с первичной документацией;Обязанности:  сверка взаиморасчетов с контрагентами подбор первичной документации по запросам архивация документов выполнение поручений руководителя и главного бухгалтера  Требования:  опыт работы от года профильное образование  Условия:  5/2 с 8-00 до 17-00 ;;Бухгалтер;Зеленоград;"Бухгалтерский учет; Основы бухгалтерского учета, налогообложения и аудита; Практикум по бухгалтерскому учету; Бухгалтерский и управленческий учет; Отраслевые особенности ведения бухгалтерского учета; Бухгалтерский учёт; Интеллектуальные ресурсы: аспекты бухгалтерского учёта. Основы бухгалтерского учёта неосязаемых активов предприятия; Бухгалтерский учет и отчетность; Бухгалтерский учeт; Основы бухгалтерского учета и аудита; Актуальные проблемы административной ответственности; Современный менеджер: введение в профессию; Кадровый документооборот: от приема до увольнения; Основы аудита финансовой отчетности; Новые тренды в профессии аудитора и консультанта: взгляд профессионалов; Бухгалтерский учет и аудит в юридической практике; Учет и аудит по видам экономической деятельности; Бухгалтерский и управленческий учет, анализ финансовой отчетности; Коммуникативные стратегии в управлении: рассказ в профессиональном дискурсе; Обучение и развитие персонала на основе оценки: комплексный управленческо-юридический подход; Практический курс по работе в системе 1С; Процессуальные документы по административным делам; Бухгалтерский учет и анализ; Публичное управление; Аналитика сотрудников: прогнозы результативности и эффективная политика управления";"Бухгалтерский учет; Основы бухгалтерского учета, налогообложения и аудита; Бухгалтерский и управленческий учет; Отраслевые особенности ведения бухгалтерского учета; Бухгалтерский учёт; Основы бухгалтерского учёта. Основы бухгалтерского учета неосязаемых активов предприятия; Бухгалтерский учет и отчетность; Бухгалтерский учeт; Основы бухгалтерского учета и аудита"
Бухгалтер;"Мы - компания ProSMD, профессионально занимаемся оборудованием для поверхностного монтажа печатных плат.В настоящее время компания активно развивается и ищет к себе в команду сильных специалистов, которые готовы обучаться, расти и работать в дружной команде.Сейчас мы пользуемся услугами бухгалтерии на аутсорсинге. Нас всё устраивает в части составления отчётности - не хватает ""рук"" для наведения порядка в первичных документах и управленческой отчетности. Нам нужен штатный надёжный и внимательный бухгалтер. Какую работу нужно будет делать?  Работа с первичной документацией; Хранение и учёт документов; Взаимодействие с отделами компании: формирование реализаций, отчётов по дебиторской и кредиторской задолженности и пр. (по инструкции); Работа с банк клиентом; Договорная работа;  При поиске нового коллеги для нас важны:  Опыт работы на участке с поставщиками, материалами, ОС, подотчётными лицами в коммерческих организациях; Знание ОСНО, УСН; Знание управленческого финансового учета (ОДДС, ОПиУ, баланс), опыт работы с тендерами будет преимуществом. Уверенный пользовательский опыт в 1С (Бухгалтерия / ЗУП/ УПП), продуктов Microsoft (Excel и Word). Опыт работы с системами ЭДО; Личные качества: ответственность, аккуратность, коммуникабельность, внимание к деталям, клиентоориентированность, хорошая скорость выполняемой работы. Мы ищем думающего, коммуникабельного человека. Нам важна аккуратность в работе с цифрами.  Предлагаемые условия:  Привычный график работы: с 9:00 до 18:00 (обед с 13:00 до 14:00), суббота и воскресенье - выходные дни; Своевременная заработная плата; Удобное расположение компании в центре города, комфортный офис; Дружественный коллектив, понимающее руководство. Коллеги готовы поддержать и словом, и делом; Окончательный уровень заработной платы будет согласовываться индивидуально с кандидатом.  Если вас заинтересовала наша вакансия, просим в сопроводительном письме указать ответ на вопрос: ""Какие налоги платит организация на ОСН?""Присоединяйся к нашей команде профессионалов!";Первичная документация, Акты сверок, Работа с поставщиками, Работа с большим объемом информации, Учет ТМЦ, Бухгалтерская отчетность, 1С: Бухгалтерия, Налоговая отчетность, Расчет заработной платы, Отчетность в ФСС, Российские стандарты бухгалтерского учета;Бухгалтер;Омск;"Управление продажами; Управление инновационными проектами, программами и портфелями; Управление инновационными проектами, программами и рисками; Маркетинг и продажи; Учимся со-управлять инновационной компанией; Управление проектами; Логистика и управление цепями поставок; Проектный семинар ""Территориальное планирование""; Механизмы финансирования и реализации проектов; Управление проектами создания интеллектуальных транспортных систем; Практический курс по работе в системе 1С; Управление ИТ-проектами; Анализ требований и проектирование информационных систем; Производственный менеджмент; Учет и аудит по видам экономической деятельности";"Учет и аудит по видам экономической деятельности; Производственный менеджмент; Управление проектами; Управление ИТ-проектами; Анализ требований и проектирование информационных систем; Логистика и управление цепями поставок; Управление продажами; Маркетинг и продажи;"
Специалист по ИТ закупкам;"Обязанности:  Организация и проведение закупочных процедур (выбор поставщиков и подрядчиков) на электронных торговых площадках по направлению ""Информационные технологии"", от этапа разработки закупочной документации до выбора поставщика и заключения договоров. Анализ рынка поставщиков товаров, работ и услуг в сфере информационных технологий. Изучение и отслеживание политики ценообразования. Разработка стратегий закупок.  Требования:  Знание рынка ""Информационных технологий"": производители, дистрибьюторы, техническая часть. Опыт разработки, сборки или эксплуатации информационных систем (оборудование, программное обеспечение) приветствуется. Опыт в области закупок (223-ФЗ, 44-ФЗ) компонентов информационных технологий приветствуется. Умение работать с большими объемами информации, аналитические навыки. Знание Excel на продвинутом уровне. Наличие сильных устных и письменных коммуникативных навыков, умение вести переговоры на руководящих уровнях как внутри компании, так и с поставщиками.  Условия:  Работа в крупнейшем провайдере интернета для дома и бизнеса; Оформление по ТК РФ; Офис в шаговой доступности; ДМС со стоматологией после испытательного срока; Корпоративная мобильная связь с первого дня; Программа лояльности совместно с компаниями партнерами. ";Ведение переговоров, Заключение договоров, Анализ рынка, Закупка товаров и услуг, Закупки;Менеджер по закупкам;Екатеринбург;"Управление закупками в цепях поставок; Управление цифровыми цепями поставок; Управление продуктом и продуктовая аналитика; Анализ и постановка задачи на создание информационных систем; Технологии разработки и принятия управленческих решений; Логистика и управление цепями поставок; Аналитика цепей поставок; Управление закупками и контрактами; Управление цифровым продуктом; Логистика цифровых платформ и агрегаторов; Продюсирование и продакшн; Управление внедрением информационных систем; Стратегическое управление закупками и запасами в цепях поставок; Предпринимательство и продажи на маркетплейсах; Введение в профессию; Научно-исследовательский семинар ""Основы электронной коммерции ""; Управление ИТ-продуктом; Продюсирование и продакшен; Современные инструменты управления цепями поставок; Логистика и управление цепями поставок в ритейле; Профориентационный семинар ""Введение в управление цифровым продуктом""; Управление цепями поставок в инновационном бизнесе; Управление продажами и взаимоотношениями с клиентами; Управление цифровыми продуктами; Информационные технологии";"Управление закупками в цепях поставок; Управление цепями поставок; Управление цифровыми цепями поставок; Управление продуктом и продуктовая аналитика; Аналитика цепей поставок; Управление закупками и контрактами; Управление цифровым продуктом; Управление внедрением информационных систем; Управление ИТ-продуктом;"
